{"$schema":"https://json-schema.org/draft/2020-12/schema","additionalProperties":false,"properties":{"command":{"items":{"maximum":255,"minimum":0,"type":"integer"},"type":"array"},"enabled":{"type":"boolean"},"minimum_bid_ticks":{"minimum":0,"type":"integer"},"minimum_observations":{"minimum":1,"type":"integer"},"schema":{"const":1}},"required":["schema","enabled","minimum_observations","minimum_bid_ticks","command"],"type":"object"}