{"schema":1,"enabled":true,"minimum_observations":8,"minimum_bid_ticks":100,"command":[132,118,116,105,99,107,119,105,114,101,46,118,101,110,117,101,45,99,111,109,109,97,110,100,1,132,139,80,1,1,1,1,1,1,1,1,1,1,1,1,1,1,1,1,1,2,2,1,3,4,1,6,27,0,0,63,247,255,13,36,38,7,139,1,80,21,21,21,21,21,21,21,21,21,21,21,21,21,21,21,21,1,9,10,11,27,0,0,63,234,6,197,204,38,80,3,3,3,3,3,3,3,3,3,3,3,3,3,3,3,3,80,0,0,0,0,0,0,0,0,0,0,0,0,0,0,0,0,0,88,32,4,4,4,4,4,4,4,4,4,4,4,4,4,4,4,4,4,4,4,4,4,4,4,4,4,4,4,4,4,4,4,4,139,25,3,233,1,1,88,32,34,34,34,34,34,34,34,34,34,34,34,34,34,34,34,34,34,34,34,34,34,34,34,34,34,34,34,34,34,34,34,34,103,66,84,67,85,83,68,84,132,1,1,99,66,84,67,39,132,3,1,100,85,83,68,84,39,132,3,1,100,85,83,68,84,39,130,1,33,130,1,36,129,1,129,135,24,101,1,1,1,25,3,233,1,27,0,0,63,234,6,197,204,38,130,1,141,102,116,101,115,116,45,49,1,1,130,1,130,1,34,129,130,6,4,129,129,1,1,129,1,0,0,128,128,128]}